timestamp,experiment,task,split,model,pr_auc,base_rate,pr_auc_lift,recall_at_1pct,n_test,note
2026-07-01T00:13:21.255598+00:00,tx_baseline,transaction,temporal,LightGBM,0.8128,0.065,0.7478,0.1542,16670,labeled∩temporal; Time step 不进特征; MVP tabular 对照
2026-07-01T00:48:39.558463+00:00,nongnn_undirected-node2vec-LGBM,transaction,temporal,undirected-node2vec-LGBM,0.0943,0.065,0.0293,0.0342,16670,交易图按时间步断开；无跨期结构泄漏仍近随机；裸拓扑无判别力
2026-07-01T00:48:39.566171+00:00,nongnn_IsolationForest,transaction,temporal,IsolationForest,0.0353,0.065,-0.0296,0.0,16670,无监督；lift 为负=不如乱猜，反证 label provenance 主线
2026-07-01T12:40:34.536884+00:00,actor_maxproj_settingC_unknown_as_benign,actor,temporal,tx-LightGBM→max-proj,0.3086,0.0163,0.2923,0.2294,302573,ERROR-DEMO: unknown 当 benign（selective-labeling 陷阱）；此 pr_auc 是 coverage artifact 非模型质量；对照 Setting A
2026-07-01T14:59:43.040508+00:00,actor_projection_max,actor,temporal,tx-LightGBM→max-proj,0.7362,0.052,0.6842,0.1918,94950,Setting A; max aggregation; retrospective; actor label=tx label OR/max-propagation (guilt-by-assoc); 任务内可比、勿跨 tx 任务比
2026-07-01T14:59:43.053884+00:00,actor_projection_top3_mean,actor,temporal,tx-LightGBM→top3_mean-proj,0.7184,0.052,0.6664,0.1875,94950,Setting A; top3_mean aggregation; retrospective; actor label=tx label OR/max-propagation (guilt-by-assoc); 任务内可比、勿跨 tx 任务比
2026-07-01T14:59:43.066768+00:00,actor_projection_mean,actor,temporal,tx-LightGBM→mean-proj,0.7202,0.052,0.6682,0.1881,94950,Setting A; mean aggregation; retrospective; actor label=tx label OR/max-propagation (guilt-by-assoc); 任务内可比、勿跨 tx 任务比
2026-07-01T14:59:43.079955+00:00,actor_projection_sum,actor,temporal,tx-LightGBM→sum-proj,0.7243,0.052,0.6723,0.1885,94950,Setting A; sum aggregation; retrospective; actor label=tx label OR/max-propagation (guilt-by-assoc); 任务内可比、勿跨 tx 任务比
2026-07-01T21:03:52.708099+00:00,native_actor_tabular,actor,temporal-inductive,wallet-features-LightGBM,0.2968,0.0529,0.2439,0.0902,92451,"native actor (address features, NOT tx projection); inductive no-leak split; label still global/retrospective (clean split != clean label); 勿跨任务比"
